name,summary,prep_time,cook_time,total_time,servings,process,ingredients,url
Tonkatsu Shoyu Ramen (Pork Cutlet Soy Sauce Ramen),"If you have ever wanted to make Japanese noodle house ramen, this tonkatsu recipe is for you. This everyday meal is great for singles with some cooking experience; it may take longer than the overall time without cooking experience. To save time, I rarely measure each ingredient's amount due to the large number of small measurements in the recipe.",30 mins,45 mins,1 hr 15 mins,1,"Fill a small pot halfway with water. Bring to a boil; add egg and cook in boiling water for 15 minutes. Drain. Run cold water over egg and set aside to cool. | Pour sesame oil into a large skillet. Lay pork slices in oil. Cover pork with 1 tablespoon olive oil, 1/2 tablespoon sesame seeds, 1/2 of the basil, and 1/2 of the sage. Flip and cover pork with these remaining ingredients: 1 tablespoon olive oil, 1/2 tablespoon sesame seeds, basil, and sage. | Cook pork, covered, over medium-low heat, until evenly browned on the bottom, about 5 minutes. Flip and continue cooking until second side is browned, about 5 minutes more. Remove from heat. | Bring a large pot of water to a boil. Cook ramen noodles in boiling water until tender, about 3 minutes. Drain in a colander set in the sink; rinse noodles until water runs clear. Return noodles to the pot. | Stir kombu, bonito stock, soy sauce, and miso paste into noodles. Cook, stirring with chopsticks, over medium heat, until miso paste is dissolved, 3 to 5 minutes. Transfer noodles to a serving bowl. | Peel and cut egg in half lengthwise. Place egg, pork slices, and fish paste slices over noodles. Garnish with tonkatsu sauce, ginger, green onion, and black pepper.","1 large egg | 1 ½ teaspoons spicy sesame oil | 2  (1x3-inch) boneless pork chop slices | 2 tablespoons olive oil, divided | 1 tablespoon black sesame seeds, divided | 2 leaves fresh basil, chopped, divided | 1 leaf fresh sage, chopped, divided | 1 (3 ounce) package instant ramen noodles (such as Shirakiku®), seasoning packet discarded | 3 tablespoons shredded dried kombu | 1 ¾ tablespoons bonito soup stock (such as Hondashi®) | 1 ¾ tablespoons soy sauce (shoyu) | ½ teaspoon white miso paste with dashi | 4  1/3-inch slices fish paste stick (naruto) | 1 tablespoon tonkatsu sauce | 1 tablespoon sushi ginger (shoga), finely chopped | 1  green onion, thinly sliced | 1 pinch ground black pepper",https://www.allrecipes.com/recipe/254262/tonkatsu-shoyu-ramen-pork-cutlet-soy-sauce-ramen/
Japanese Ginger Pork,This recipe uses thinly sliced pork for a quick Japanese-style sauté. It is excellent with rice and steamed veggies on the side. You can also double the recipe and use whole pork chops or chicken breasts for grilling.,10 mins,10 mins,1 hr 20 mins,4,"Mix together soy sauce, sake, mirin, and ginger in a large bowl until combined. Add sliced pork; stir to coat. Cover the bowl and marinate for about 1 hour. | Heat oil in a large skillet or wok over high heat. Sauté pork in hot oil until browned and cooked through; discard marinade. An instant-read thermometer inserted into pork should read at least 145 degrees F (63 degrees C).",2 tablespoons soy sauce | 2 tablespoons sake | 2 tablespoons mirin | 1 tablespoon grated fresh ginger root | 1 pound thinly sliced pork loin | 3 tablespoons vegetable oil,https://www.allrecipes.com/recipe/87392/japanese-ginger-pork/
Japanese Curry,"Japanese curry is different from Indian or Thai curries. It is more of a brown stew and it can be mild or spicy, depending on your tastes. It can be served over white rice or with udon noodles.
This recipe is very flexible; it can easily be made for more or less people.",30 mins,1 hr 10 mins,1 hr 40 mins,8,"Heat oil in a 6-quart pot over medium-high heat. Add beef and saute until brown, 5 to 7 minutes. Add onions and cook until starting to soften, about 3 minutes. Add ketchup and Worcestershire sauce. Stir to coat. Add cayenne pepper. Pour in water to cover mixture by 1 or 2 inches. Add carrots and bouillon. | Simmer, skimming fat off the surface of the broth as needed, for 30 minutes. Add potatoes. Stir in 1 package of curry roux and let dissolve; add remaining curry as needed to achieve desired thickness. Continue simmering until beef and vegetables are tender, about 30 minutes more.","1 tablespoon vegetable oil, or more as needed | 1 ¾ pounds beef chuck, cut into 2-inch cubes | 3  onions, quartered | 1 tablespoon ketchup | 1 ½ teaspoons Worcestershire sauce | 1 pinch cayenne pepper, or to taste (Optional) | water to cover | 4  carrots, cut into 2-inch pieces | 1 cube chicken bouillon (Optional) | 3 medium potatoes, cut into 3-inch chunks | 1 ½ (3.5 ounce) containers Japanese curry roux, or more to taste",https://www.allrecipes.com/recipe/274077/japanese-curry/
Spicy Tuna Sushi Roll,"A great tasting spicy sushi roll, for those who like extra pizzazz. You can use cooked or raw tuna to your preference to achieve great flavors. Great for a filling Japanese meal. Tastes great with a wasabi soy dip.",40 mins,20 mins,1 hr 45 mins,4,"Bring the rice, water, and vinegar to a boil in a saucepan over high heat. Reduce heat to medium-low, cover, and simmer until the rice is tender, and the liquid has been absorbed, 20 to 25 minutes. Let stand, covered, for about 10 minutes to absorb any excess water. Set rice aside to cool. | Lightly mix together the tuna, mayonnaise, chili powder, and wasabi paste in a bowl, breaking the tuna apart but not mashing it into a paste. | To roll the sushi, cover a bamboo sushi rolling mat with plastic wrap. Lay a sheet of nori, rough side up, on the plastic wrap. With wet fingers, firmly pat a thick, even layer of prepared rice over the nori, covering it completely. Place about 1 tablespoon each of diced cucumber, carrot, and avocado in a line along the bottom edge of the sheet, and spread a line of tuna mixture alongside the vegetables. | Pick up the edge of the bamboo rolling sheet, fold the bottom edge of the sheet up, enclosing the filling, and tightly roll the sushi into a thick cylinder. Once the sushi is rolled, wrap it in the mat and gently squeeze to compact it tightly. Cut each roll into 6 pieces, and refrigerate until served.","2 cups uncooked glutinous white rice | 2 ½ cups water | 1 tablespoon rice vinegar | 1 (5 ounce) can solid white tuna in water, drained | 1 tablespoon mayonnaise | 1 teaspoon chili powder | 1 teaspoon wasabi paste | 4 sheets nori (dry seaweed) | ½  cucumber, finely diced | 1  carrot, finely diced | 1  avocado - peeled, pitted and diced",https://www.allrecipes.com/recipe/190943/spicy-tuna-sushi-roll/
Tonkatsu (Japanese Pork Chop),"This Tonkatsu recipe uses thinly sliced boneless pork chops and panko, which are Japanese bread crumbs that are really light and airy.",25 mins,10 mins,40 mins,8,"Combine eggs, milk, garlic, salt, and pepper in a medium bowl until well mixed. Heat oil in a large heavy skillet over medium-high heat. Place panko crumbs in a shallow bowl. | Dip pork chops in egg mixture, then coat with panko crumbs; dip in the egg mixture again, then coat with another layer of panko crumbs. Lay coated chops on a plate until the rest are finished. If you have time, let them set for about 10 minutes, and the coating will set very well. | When oil is very hot, place pork chops into the pan, and fry for about 5 minutes on each side, until golden brown.",2  eggs | 1 teaspoon milk | ½ teaspoon minced garlic | salt to taste | ½ teaspoon pepper | 1 cup vegetable oil for frying | 8  thin cut boneless pork chops | 1 ½ cups panko crumbs,https://www.allrecipes.com/recipe/58793/tonkatsu-asian-style-pork-chop/
Buffalo Chicken Sushi Roll,"I made this Buffalo chicken sushi recipe for my wife, who is not into raw sushi fish. Now, the whole family is totally hooked on it!",25 mins,N/A,25 mins,4,"Combine chicken and hot sauce in a bowl; toss to coat. | Place 1 nori sheet onto a bamboo sushi rolling mat. Spread 1 cup rice onto nori, leaving a 1/2-inch strip along 1 edge. Place 1/4 each chicken, carrot, and celery in a line near bottom edge of rice. Roll nori sheet around rice and fillings, using the mat to help. Moisten remaining nori edge with a finger dipped in water; press to seal. Repeat with remaining nori, rice, chicken, carrot, and celery. | Slice each roll into 8 pieces using a sharp, wet knife. Top each piece with a dollop of mayonnaise and a small amount of onion.","8 ounces fully cooked breaded chicken breast tenderloins | ¼ cup hot pepper sauce | 4 sheets nori (dry seaweed) | 4 cups cooked sushi rice | 1  carrot, peeled and cut into 4-inch matchsticks | 1  celery stalk, cut into 4-inch matchsticks | ¼ cup spicy mayonnaise | ¼ cup French-fried onions (such as French's)",https://www.allrecipes.com/recipe/239021/buffalo-chicken-sushi-roll/
