name,summary,prep_time,cook_time,total_time,servings,process,ingredients,url
Mom's Sushi Rice,This is my mom's simple and easy recipe for sushi rice. Can be modified to your taste.,10 mins,20 mins,1 hr 5 mins,10,"Place rice into a large, deep bowl. Fill with cold water and rub rice together with hands until water turns milky white. Pour off cloudy water, being careful not to pour out rice. Repeat 3 or 4 times until you can see rice through 3 inches of water. | Drain rice in a fine strainer, then place into a saucepan along with konbu and 3 cups water. Allow to stand for 30 minutes. Stir together rice vinegar, sugar, and salt until dissolved in a small bowl; set aside. | Cover, and bring rice to a boil over high heat, then reduce heat to low, and simmer for 15 minutes. Remove from heat and allow to stand, covered, for 5 minutes. | Scrape rice into a bowl; remove and discard konbu. Stir in vinegar mixture until well incorporated and no lumps of rice remain. Allow to cool at room temperature. For a shinier appearance, use an electric fan to cool rice rapidly.",2 ¼ cups Japanese sushi-style rice | 1 (4 inch) piece konbu dried kelp (Optional) | 3 cups water | ¼ cup rice vinegar | ¼ cup white sugar | 1 ¼ teaspoons salt,https://www.allrecipes.com/recipe/137596/moms-sushi-rice/
Japanese Broiled Mackerel,"A Japanese marinade sauce gives a lovely taste and texture to broiled mackerel in this Japanese mackerel recipe. Yellowtail, tuna, or salmon are also good in this recipe. Easy and delectable! Serve with a lemon slice or long white radish slice as a garnish.",20 mins,5 mins,25 mins,4,"Rinse fillets; pat dry with paper towels. | Mix together soy sauce, mirin, sugar, and fresh ginger in a medium bowl. Place fillets into marinade and let stand for at least 20 minutes. | Preheat the oven broiler or an outdoor grill for high heat. | Cook fillets in the preheated broiler, basting occasionally, until fish flakes easily with a fork, 5 to 8 minutes.",4  mackerel fillets | ¼ cup soy sauce | ¼ cup mirin (Japanese sweet wine) | 1 tablespoon white sugar | ½ tablespoon grated fresh ginger root,https://www.allrecipes.com/recipe/29497/japanese-broiled-mackerel/
Authentic Yakisoba,"This authentic yakisoba was taught to me by my host mother when I lived in Osaka, Japan. It is the real deal and my friends love it.",30 mins,25 mins,55 mins,8,"Bring a large pot of water to a boil. Cook soba in boiling water, stirring occasionally, until noodles are tender yet firm to the bite, 5 to 8 minutes. Drain noodles and rinse with cold water. Set aside. | Heat oil in a wok over medium heat. Add pork and stir-fry with a pinch of salt and pepper, about 5 minutes. Transfer meat to a plate, reserving oil in wok. Add carrots, onion, ginger, and garlic to the wok and stir-fry for 3 to 4 minutes. | Add cabbage to the wok and stir-fry briefly, about 1 minute. Add drained soba noodles. Pour in 1/2 the yakisoba sauce and stir-fry until noodles and vegetables are covered with sauce, about 3 minutes. Return pork to the wok. Add additional sauce as desired. Remove from heat. | Garnish yakisoba with kizami nori and a small pile of beni shoga just before serving.","4 (8 ounce) packages buckwheat soba noodles | 2 tablespoons vegetable oil | 1 pound pork tenderloin, cut against the grain in thin strips | 2 cups carrots, cut into julienne strips | 1 medium onion, cut into julienne strips | 1 tablespoon freshly grated ginger | 3 cloves garlic, minced | ½ head napa cabbage, shredded | ⅔ cup yakisoba sauce | salt and ground black pepper to taste | 4 tablespoons pickled red ginger (beni shoga), or to taste | 4 tablespoons kizami nori (dried flaked aonori seaweed), or to taste",https://www.allrecipes.com/recipe/272610/authentic-yakisoba/
Air Fryer Tonkatsu,"This air fryer tonkatsu recipe is crispy on the outside and tender and juicy on the inside. You can buy bottled sauce, but this homemade version is simple to make and far better. Serve over rice if desired.",10 mins,20 mins,30 mins,4,"Make sauce: Whisk together ketchup, soy sauce, brown sugar, sherry, Worcestershire sauce, and garlic in a medium bowl until sugar is dissolved. Set sauce aside. | Preheat an air fryer to 350 degrees F (175 degrees C). | Prepare pork chops: Lay pork chops on a clean work surface; season with salt and pepper. | Beat eggs in a flat dish. Place bread crumbs in a separate flat dish. | Dip a pork chop in beaten eggs, then dredge in bread crumbs. Dip again in eggs, then press in bread crumbs to thoroughly coat. Repeat with remaining pork chops. | Place pork chops in the basket of the preheated air fryer and spray the tops with nonstick cooking spray. Air-fry for 10 minutes. Flip chops over using a spatula and spray the tops with nonstick cooking spray again. Air-fry for 10 more minutes. An instant-read thermometer inserted into the center of pork chops should read 145 degrees F (63 degrees C). | Transfer pork chops to a cutting board and slice. Serve with sauce.",½ cup ketchup | 2 tablespoons soy sauce | 1 tablespoon brown sugar | 1 tablespoon sherry | 2 teaspoons Worcestershire sauce | 1 teaspoon minced garlic | 1 pound boneless pork breakfast chops (4 chops) | salt and ground black pepper to taste | 2 large eggs | 1 ½ cups panko bread crumbs | nonstick cooking spray,https://www.allrecipes.com/recipe/278809/air-fryer-tonkatsu/
Crispy Shrimp Tempura,"Crispy, Japanese-style tempura shrimp made with homemade tempura batter. Serve them as an appetizer, main dish, or finger food at your next party.",15 mins,20 mins,35 mins,4,N/A,"2 cups vegetable oil for frying | 1 cup all-purpose flour | 2 tablespoons cornstarch | 1 pinch salt | 1 cup water | 1 large egg yolk | 2 large egg whites, lightly beaten | 1 pound medium shrimp, peeled and deveined, tails left on",https://www.allrecipes.com/recipe/129467/crispy-shrimp-tempura/
Sesame-Seared Tuna,"This sesame-seared tuna is an easy, great-tasting dish. Fresh tuna steaks are coated with sesame seeds, then quickly seared and served rare, so be sure to use good quality fresh tuna.",10 mins,1 mins,11 mins,4,N/A,¼ cup soy sauce | 2 tablespoons sesame oil | 1 tablespoon mirin (Japanese sweet wine) | 1 tablespoon honey | 1 tablespoon rice wine vinegar | ½ cup sesame seeds | 4 (6 ounce) tuna steaks | 1 tablespoon olive oil | wasabi paste,https://www.allrecipes.com/recipe/71698/sesame-seared-tuna/
Japanese Sweet Omelet,"Tamagoyaki is a delicious, easy, and fun Japanese breakfast! Serve hot with shaved daikon (Japanese radish) and soy sauce.",5 mins,5 mins,10 mins,1,"Mix eggs, water, soy sauce, and sugar in a bowl with a fork until combined. | Heat a skillet over medium heat. Pour egg mixture into skillet and stir with a fork. Cook until omelet begins to set and liquid is no longer visible, 3 to 5 minutes. Fold in half twice.",2  eggs | 1 tablespoon water | 1 teaspoon soy sauce | 1 teaspoon white sugar,https://www.allrecipes.com/recipe/254315/japanese-sweet-omelet/
Japanese-Style Deep-Fried Shrimp,"These deep-fried shrimp are coated with crispy panko crumbs to make the easiest, tastiest deep-fried shrimp ever!",10 mins,15 mins,25 mins,4,N/A,"1 pound medium shrimp, peeled (tails left on) and deveined | ½ teaspoon salt | ½ teaspoon ground black pepper | ½ teaspoon garlic powder | 1 cup all-purpose flour | 1 teaspoon paprika | 2 large eggs, beaten | 1 cup panko crumbs | 1 quart vegetable oil for frying",https://www.allrecipes.com/recipe/127500/japanese-style-deep-fried-shrimp/
Japanese Egg Salad Sandwich,"This is my take on the Japanese egg salad sandwich (tamago sando) which is world-famous, plus I'm going to show you how to make a version of a mayonnaise so addictive, it literally has a cult following. If that wasn't enough, I'm also going to tease an upcoming video for the world's most critically-acclaimed milk bread.",10 mins,15 mins,1 hr 25 mins,2,"Place eggs in the bottom of a saucepan. Add 1/4 inch of water. Heat over medium-high heat and bring to a boil. Cover and steam for 11 minutes. Turn off the heat and drain water carefully; pour cold water over and let cool. | Mix mayonnaise, salt, sugar, mustard, hot sauce, lemon juice, and vinegar for Kewpie-style mayonnaise together. Cover with plastic wrap and refrigerate until needed. | Peel eggs. Mash in a shallow bowl with the side and back of a fork until desired texture is reached. Add salt, sugar, cayenne, heavy cream, and 3 tablespoons Kewpie-style mayonnaise. Stir to combine. Wrap and refrigerate until well chilled, at least 1 hour. Taste and adjust seasonings.","4 large eggs | ½ cup mayonnaise | ¼ teaspoon kosher salt | ¾ teaspoon white sugar | 1 teaspoon Dijon mustard | 3 dashes hot sauce, or to taste | 1 teaspoon freshly squeezed lemon juice | 2 teaspoons rice vinegar | ½ teaspoon kosher salt, or to taste | ¼ teaspoon white sugar | 1 pinch cayenne pepper | 1 tablespoon heavy cream | 4 slices soft white bread | 1 tablespoon unsalted butter, softened",https://www.allrecipes.com/recipe/283909/japanese-egg-salad-sandwich-tamago-sando/
Japanese Pan Noodles,This is a great recipe to make any time. Lots of flavor. Top with cilantro and bean sprouts.,25 mins,25 mins,50 mins,4,"Bring a large pot of lightly salted water to a boil. Cook udon in boiling water, stirring occasionally, until noodles are tender yet firm to the bite, 10 to 12 minutes. Drain and rinse with cold water. Stir in a few drops of sesame oil. | Heat the remaining sesame oil in a large skillet over medium heat. Cook broccoli until bright green and still crunchy, about 5 minutes. Add green bell pepper and carrots; cook and stir until slightly softened, about 2 minutes. Add zucchini; cook until slightly softened, about 2 minutes more. Add soy sauce, mirin, chili-garlic sauce, and ginger; stir to combine. Mix in the noodles; cook and stir until noodles absorb some of the sauce, 1 to 2 minutes more.","1 (10 ounce) package fresh udon noodles | ½ teaspoon sesame oil, divided, or to taste | 2 cups chopped broccoli | ½  green bell pepper, cut into matchsticks | 2 small carrots, cut into matchsticks, or to taste | ½  zucchini, thinly sliced | 2 tablespoons soy sauce | 2 tablespoons mirin (Japanese sweet wine) | 1 tablespoon chili-garlic sauce | ¾ teaspoon minced ginger",https://www.allrecipes.com/recipe/260850/japanese-pan-noodles/
Easy Ramen with Chicken and Teriyaki Sauce,"Easy, quick, all-in-one recipe that satisfies a craving for Japanese food!",15 mins,10 mins,25 mins,2,"Add 4 cups water to a skillet and bring to a boil. Add ramen and cook until soft, about 5 minutes. | Meanwhile, melt butter in another skillet over medium heat. Add carrots, zucchini, and onion and saute until vegetables have softened, about 5 minutes. Add shredded chicken, teriyaki sauce, salt, and pepper and cook until heated through and sauce has thickened, 3 to 5 minutes. | Drain ramen and add to the vegetable and chicken mixture. Toss and add more teriyaki as needed.

 





 
 Unknown","2 (3 ounce) packages ramen noodles (flavor packets discarded) | 1 tablespoon butter | 2 medium carrots, peeled and thinly sliced | 1 medium zucchini, chopped | 1 medium onion, chopped | 2 cups cooked, shredded chicken breast meat | 1 tablespoon teriyaki sauce, or more to taste | salt and ground black pepper to taste",https://www.allrecipes.com/recipe/284318/easy-ramen-with-chicken-and-teriyaki-sauce/
Japanese Shrimp Fried Rice with Yum Yum Sauce,"Best shrimp fried rice I've ever made or had! The yum yum sauce tastes better if made the day before, so the flavors can marry.",15 mins,45 mins,1 hr,6,"Bring 3 cups water and rice to a boil in a saucepan. Reduce heat to medium-low, cover, and simmer until rice is tender and water has been absorbed, 20 to 25 minutes. Set aside and let cool. | Heat 2 tablespoons vegetable oil in a large, deep skillet over medium-high heat. Add onion and cook until soft and translucent, about 5 minutes. Stir in garlic and cook until fragrant, about 1 minute. Mix in cooked jasmine rice and frozen peas and carrots; fry until rice begins to brown, about 5 minutes. Add 2 tablespoons butter and stir to combine. Pour in eggs and cook until firm. Add oyster sauce, soy sauce, and 1/2 lemon juice; stir to combine. Season with salt and pepper. | Heat remaining 1 tablespoon vegetable oil in a separate pan over medium-high heat. Add shrimp and fry until they are bright pink on the outside and the meat is opaque, 2 to 3 minutes. Mix in remaining 2 tablespoons butter and lemon juice. Combine with fried rice mixture. | Combine mayonnaise, water, paprika, ginger paste, white sugar, garlic powder, salt, and pepper in a bowl to make the yum yum sauce. Stir well. Serve with the fried rice.","2 cups uncooked jasmine rice | 3 cups water | 3 tablespoons vegetable oil, divided | 1  sweet onion, chopped | 2 cloves garlic, crushed and minced | 1 (16 ounce) package frozen peas and carrots | 4 tablespoons butter, divided | 2  eggs | 4 tablespoons oyster sauce | 3 tablespoons soy sauce | 1  lemon, juiced, divided | salt and pepper to taste | 1 pound uncooked medium shrimp, peeled and deveined | 1 cup mayonnaise | 3 tablespoons water | 2 tablespoons paprika | 1 teaspoon ginger paste | 1 teaspoon white sugar | ½ teaspoon garlic powder | salt and pepper to taste",https://www.allrecipes.com/recipe/272802/japanese-shrimp-fried-rice-with-yum-yum-sauce/
Miso Braised Pork,Japanese comfort food! The smell will draw you in!,15 mins,3 hrs 30 mins,3 hrs 45 mins,12,"Heat canola oil in a large Dutch oven over medium-high heat until hot. Sear pork slices until well browned on both sides, then remove. Stir in the garlic and ginger, cook until fragrant, about 30 seconds. Add the water, soy sauce, brown sugar, and miso; bring to a simmer, scraping the bottom of the pan to dissolve the caramelized juices. | Place pork into pot, add additional water if needed to cover pork with the sauce. Then, reduce heat to medium-low, cover, and simmer for 3 hours until the pork is tender, and the sauce has thickened.","1 tablespoon canola oil | 5 pounds pork butt (shoulder roast) cut into 2-inch slices | 2 tablespoons minced garlic | 1 teaspoon minced ginger | 2 cups water, more if needed | ⅓ cup soy sauce | ⅓ cup brown sugar | ¾ cup white (shiro) miso",https://www.allrecipes.com/recipe/116066/miso-braised-pork/
Spicy Tuna Rolls,"Even if you're new to sushi making, this recipe for spicy tuna rolls is easy to make at home.",30 mins,N/A,30 mins,4,"Cut off the bottom quarter of each nori sheet; reserve for another use. | Combine chopped tuna, mayonnaise, green onions, and hot sauce in a bowl. | Center 1 sheet of nori on a bamboo sushi mat. Wet your hands. Spread a thin layer of rice on the nori using your hands; press into a thin layer, leaving a 1/2-inch space at the bottom edge. Sprinkle with sesame seeds. Arrange 1/4 of the tuna mixture in a line across the rice, about 1/3 of the way down from the top of the sheet. | Wet the uncovered edge of the nori. Lift the top end of the mat and firmly roll it over the ingredients. Roll it forward to make a complete roll. Repeat with remaining ingredients. | Slice the rolls into 3/4-inch pieces using a wet knife. Serve immediately or refrigerate until serving.","4 sheets nori (dry seaweed) | ½ pound sashimi-grade tuna, finely chopped | 4 tablespoons mayonnaise | 2  green onions, chopped | 1 tablespoon hot chile sauce | 2 ½ cups prepared sushi rice | 1 tablespoon sesame seeds",https://www.allrecipes.com/recipe/279434/spicy-tuna-rolls/
Tonkatsu,"These breaded and fried pork cutlets make a traditional Japanese dish, tonkatsu, that is very simple and easy to make. Serve with sticky rice and tonkatsu sauce and enjoy! Also great if substituted with chicken breasts.",20 mins,20 mins,40 mins,4,"Place pork chops between two sheets of heavy plastic (resealable freezer bags work well) on a solid, level surface. Firmly pound pork with the smooth side of a meat mallet to a 1/4-inch thickness (about .75 cm). Season with salt and black pepper. | Pour oil into a skillet until 1/2 inch (1.25 cm) deep; heat over medium-high heat to 375 degrees F (190 degrees C). | Place flour, egg, and panko bread crumbs into 3 separate bowls. Dredge pork cutlets in flour; shake off excess. Dip into beaten egg. Lift up so excess egg drips back into the bowl. Press into bread crumbs to coat both sides; tap off any loose crumbs. Place breaded cutlets, unstacked, onto a plate. | Lower cutlets carefully into the hot oil. Fry until golden brown and cooked through, about 4 minutes per side. Transfer to a paper-towel-lined plated to drain.","4 (4 ounce) boneless pork chops | salt and ground black pepper to taste | 2 cups oil for frying, or as needed | ¼ cup all-purpose flour | 1  egg, beaten | ¾ cup panko (Japanese-style) bread crumbs",https://www.allrecipes.com/recipe/46543/tonkatsu/
Instant Pot Sushi Rice,"This sushi rice recipe is made in an Instant Pot. This simple method always ensures perfectly cooked grains. I tested four different methods before deciding this was the best. Using the Manual function instead of the Rice setting gives the rice a tender bite and separated grains, yet it's still sticky enough to make compact sushi rolls. This recipe yields enough rice for 3 standard sushi rolls.",25 mins,15 mins,1 hr,6,"Place rice in the insert of a multi-functional pressure cooker (such as Instant Pot). Add enough water to cover and rinse rice, mixing it in a circular motion. Strain through a sieve. Repeat until water comes out clear, about five rinses total. Spread drained rice onto a clean cloth and let dry for 10 to 15 minutes. | Clean kombu gently with a damp towel, but do not remove the white powder, which is important for the umami flavor. Break off a small piece of kombu and place into a small saucepan. | Place remaining kombu into the Instant Pot with rice and 1 1/4 cups water. Close and lock the lid. Select high pressure according to manufacturer's instructions; set the timer for 2 minutes. Allow 10 to 15 minutes for pressure to build. | Release pressure on the Instant Pot using the natural-release method according to manufacturer's instructions, about 8 minutes. Release any additional pressure carefully using the quick-release method. Unlock and remove the lid. | While the pressure is releasing, add rice wine, hon mirin, sugar, and sea salt to the saucepan. Heat over low heat until sugar and salt have dissolved; do not boil. | Use a rice paddle to gently scrape rice into a glass or ceramic bowl; remove and discard kombu. | Remove and discard the smaller kombu piece from the vinegar mixture. Sprinkle vinegar mixture over rice and cut it in with the rice paddle. Stir until vinegar mixture is well incorporated and no lumps of rice remain. Allow to cool to room temperature, fanning the rice with a piece of cardboard if desired to speed up cooling.",1 cup Japanese sushi-style rice | 1 (2 inch) piece kombu (Japanese dried kelp) | 1 ¼ cups water | 3 tablespoons Japanese rice wine | 1 tablespoon hon mirin (Japanese mirin) | ¾ tablespoon white sugar | ½ teaspoon sea salt,https://www.allrecipes.com/recipe/278798/instant-pot-sushi-rice/
Japanese Beef Stir-Fry,Tender beef strips are quickly stir-fried with crisp and colorful vegetables to make this delicious restaurant-style dinner in your own kitchen.,30 mins,15 mins,45 mins,8,"Slice beef into very thin strips. | Mix cornstarch, broth, soy and sugar until smooth. Set aside. | Heat 1 tablespoon oil in saucepot or wok over high heat. Add beef in 2 batches and stir-fry until browned. Set beef aside. | Add 1 tablespoon oil. Add the mushrooms, cabbage, peppers, celery and green onions in 2 batches and stir-fry over medium heat until tender-crisp. Set vegetables aside. | Stir cornstarch mixture and add. Cook until mixture boils and thickens, stirring constantly. Return beef and vegetables to saucepot and heat through. Serve over rice.","2 pounds boneless beef sirloin or beef top round steaks (3/4"" thick) | 3 tablespoons cornstarch | 1 (10.5 ounce) can  Campbell's® Condensed Beef Broth | ½ cup soy sauce | 2 tablespoons sugar | 2 tablespoons vegetable oil | 4 cups sliced shiitake mushrooms | 1 head Chinese cabbage (bok choy), thinly sliced | 2 medium red peppers, cut into 2""-long strips | 3 stalks celery, sliced | 2 medium green onions, cut into 2"" pieces | Hot cooked regular long-grain white rice",https://www.allrecipes.com/recipe/212636/japanese-beef-stir-fry/
Karaage (Japanese Fried Chicken) with Honey Mayoster Sauce,"This karaage (Japanese fried chicken) with honey mayoster sauce recipe is very easy to make and my guests always enjoy it a lot! It can be served as an appetizer or over a bed of rice as a quick weekday dinner! I usually marinate it the night before to give it more flavor, but if it's a last-minute meal you are preparing, no worries because there's still dipping sauce! Serve it with hot with shredded lettuce and a lemon wedge.",15 mins,5 mins,8 hrs 20 mins,4,"Whisk 1 1/2 tablespoons soy sauce, 1 tablespoon honey, garlic, and ginger together in a large glass or ceramic bowl. Add chicken and toss to evenly coat. Cover the bowl with plastic wrap and marinate in the refrigerator for 8 hours to overnight. | Remove chicken from marinade and shake off excess. Discard remaining marinade. | Beat egg in a bowl until smooth. Add panko bread crumbs to a shallow bowl. Dip chicken into beaten egg. Lift up so excess egg drips back in the bowl. Press into panko until completely coated. Place the breaded chicken, unstacked, onto a plate. Repeat with remaining chicken. | Heat oil in a deep fryer or large saucepan to 350 degrees F (175 degrees C). Lower chicken carefully into the hot oil in batches. Fry until golden brown, about 5 minutes. Transfer to paper towels to drain. Repeat with remaining chicken. | Whisk Japanese mayonnaise, mirin, 2 tablespoons honey, Dijon mustard, and 1 tablespoon soy sauce together in a bowl; pour sauce over chicken.","1 ½ tablespoons low-sodium soy sauce | 1 tablespoon honey | 2 teaspoons minced garlic | 2 teaspoons minced fresh ginger | 1 pound skinless, boneless chicken thighs, cut into bite-sized pieces | 1  egg | 1 cup panko bread crumbs | vegetable oil for frying | ½ cup Japanese mayonnaise | 3 tablespoons mirin (Japanese sweet wine) | 2 tablespoons honey | 2 tablespoons Dijon mustard | 1 tablespoon low-sodium soy sauce",https://www.allrecipes.com/recipe/258032/karaage-japanese-fried-chicken-with-honey-mayoster-sauce/
Pork Gyoza,Gyoza are pan-fried Japanese dumplings which make perfect starters or nibbles. Filled with a savory mixture of ground pork and Japanese flavors.,1 hr,8 mins,1 hr 8 mins,6,"Combine ground pork, cabbage, egg, spring onions, 1 tablespoon soy sauce, sake, mirin, and ginger in a large bowl; mix well. | Place approximately 1 to 2 teaspoons of the pork mixture in the center of each gyoza wrapper. Moisten your fingers with water and rub around the edges of each wrapper. Fold wrappers in half over filling, creating a semi circle. Take one side of the wrapper and make crimps along the edges for a decorative pattern (like pleats of a skirt) and press along the edges to seal the two sides together. Ensure there isn't much excess air caught inside the dumpling. Repeat until all the pork mixture is used. | Heat vegetable oil in a large skillet over medium-high heat. Place as many gyoza in the skillet as fit in a single layer and fry until the bottom is browned, about 3 to 5 minutes. Add water to skillet and reduce heat. Cover and allow gyoza to steam until all the water has evaporated, about 5 minutes. Repeat with the remaining gyoza. | Mix rice vinegar and soy sauce together for a dipping sauce and serve with the gyoza.

 





 
 ChefJackie","12 ounces ground pork | ¼ head cabbage, shredded | 1  egg | 2  spring onions, sliced | 1 tablespoon soy sauce | 2 teaspoons sake | 2 teaspoons mirin | 2 teaspoons minced fresh ginger root | 40  gyoza wrappers, or as needed | 2 tablespoons vegetable oil | ½ cup water | ¼ cup rice wine vinegar | ¼ cup soy sauce",https://www.allrecipes.com/recipe/259900/pork-gyoza/
